{
  "$schema": "http://json-schema.org/draft-07/schema#",
  "$id": "spec-compile-receipt.schema.v1",
  "type": "object",
  "additionalProperties": false,
  "required": ["schema_version", "receipt_id", "compiler_version", "source_document_sha256", "document_xml_sha256", "store_records_sha256", "receipt_set_sha256", "evidence_envelope_sha256", "specification_evidence_ids", "specification_evidence_sha256", "rubric_sha256", "fd_confirm_flag", "approval_state"],
  "properties": {
    "schema_version": { "const": "spec-compile-receipt/v1" },
    "receipt_id": { "type": "string", "minLength": 1 },
    "compiler_version": { "type": "string", "minLength": 1 },
    "source_document_sha256": { "type": "string", "pattern": "^[a-f0-9]{64}$" },
    "document_xml_sha256": { "type": "string", "pattern": "^[a-f0-9]{64}$" },
    "store_records_sha256": { "type": "string", "pattern": "^[a-f0-9]{64}$" },
    "receipt_set_sha256": { "type": "string", "pattern": "^[a-f0-9]{64}$" },
    "evidence_envelope_sha256": { "type": "string", "pattern": "^[a-f0-9]{64}$" },
    "specification_evidence_ids": { "type": "array", "minItems": 1, "items": { "type": "string", "minLength": 1 } },
    "specification_evidence_sha256": { "type": "string", "pattern": "^[a-f0-9]{64}$" },
    "rubric_sha256": { "type": "string", "pattern": "^[a-f0-9]{64}$" },
    "fd_confirm_flag": { "type": "object" },
    "approval_state": { "enum": ["proposal", "test-approved"] }
  }
}
